{
  "$schema": "http://json-schema.org/draft-04/schema#",
  "type": "object",
  "additionalProperties": false,
  "properties": {
    "$schema": {
      "type": "string"
    },
    "name": {
      "type": "string"
    },
    "available": {
      "type": "boolean"
    },
    "deprecated": {
      "type": "boolean"
    },
    "exposable": {
      "type": "boolean"
    },
    "no_gui": {
      "type": "boolean"
    },
    "port": {
      "type": "integer",
      "minimum": 0,
      "maximum": 65565
    },
    "https": {
      "type": "boolean"
    },
    "uid": {
      "type": "integer"
    },
    "gid": {
      "type": "integer"
    },
    "force_expose": {
      "type": "boolean"
    },
    "generate_vapid_keys": {
      "type": "boolean"
    },
    "supported_architectures": {
      "type": "array",
      "items": [
        {
          "type": "string",
          "oneOf": [
            {
              "enum": ["arm64", "amd64"]
            }
          ]
        }
      ]
    },
    "id": {
      "type": "string",
      "pattern": "^[a-z0-9-_]+$"
    },
    "tipi_version": {
      "type": "integer"
    },
    "version": {
      "type": "string"
    },
    "categories": {
      "type": "array",
      "items": [
        {
          "type": "string"
        }
      ]
    },
    "description": {
      "type": "string"
    },
    "short_desc": {
      "type": "string"
    },
    "author": {
      "type": "string"
    },
    "source": {
      "type": "string",
      "format": "url"
    },
    "website": {
      "type": "string",
      "format": "url"
    },
    "url_suffix": {
      "type": "string",
      "pattern": "^/[a-z0-9-_/]+$"
    },
    "form_fields": {
      "type": "array",
      "items": [
        {
          "type": "object",
          "additionalProperties": false,
          "properties": {
            "type": {
              "type": "string",
              "oneOf": [
                {
                  "enum": [
                    "text",
                    "password",
                    "email",
                    "number",
                    "fqdn",
                    "ip",
                    "fqdnip",
                    "random",
                    "boolean"
                  ]
                }
              ]
            },
            "label": {
              "type": "string"
            },
            "max": {
              "type": "integer"
            },
            "min": {
              "type": "integer"
            },
            "required": {
              "type": "boolean"
            },
            "env_variable": {
              "type": "string"
            },
            "hint": {
              "type": "string"
            },
            "pleaceholder": {
              "type": "string"
            },
            "regex": {
              "type": "string"
            },
            "default": {
              "type": "string"
            },
            "pattern_error": {
              "type": "string"
            },
            "options": {
              "type": "array",
              "items": {
                "type": "object",
                "additionalProperties": false,
                "properties": {
                  "label": {
                    "type": "string",
                    "label": "string"
                  }
                }
              }
            }
          },
          "required": ["type", "label", "env_variable"]
        }
      ]
    },
    "dynamic_config": {
      "type": "boolean"
    },
    "min_tipi_version": {
      "type": "string"
    }
  },
  "required": [
    "name",
    "available",
    "id",
    "tipi_version",
    "version",
    "categories",
    "description",
    "short_desc",
    "author",
    "source",
    "form_fields",
    "port",
    "dynamic_config"
  ]
}
