{
  "$schema": "../app-config-schema.json",
  "name": "Nextcloud",
  "id": "nextcloud",
  "available": true,
  "short_desc": "Nextcloud server, a safe home for all your data.",
  "author": "nextcloud",
  "port": 8745,
  "categories": ["data"],
  "description": "Store your files, contacts, calendars, conversations and more on a server of your choosing.",
  "tipi_version": 1,
  "version": "29.0.1",
  "source": "https://github.com/nextcloud/server",
  "website": "https://nextcloud.com",
  "exposable": true,
  "supported_architectures": ["arm64", "amd64"],
  "form_fields": [
    {
      "type": "text",
      "label": "Nextcloud admin username",
      "required": true,
      "env_variable": "NEXTCLOUD_ADMIN_USER"
    },
    {
      "type": "password",
      "label": "Nextcloud admin password",
      "min": 8,
      "required": true,
      "env_variable": "NEXTCLOUD_ADMIN_PASSWORD"
    },
    {
      "type": "random",
      "label": "Nextcloud database password",
      "min": 32,
      "env_variable": "NEXTCLOUD_DB_PASSWORD"
    }
  ],
  "dynamic_config": true
}
